{
  "$schema": "../schemas/monitor.target.v2.schema.json",
  "configVersion": 2,
  "id": "sample-ipc",
  "title": "Sample IPC Target",
  "control": {
    "mode": "ipc",
    "endpoint": "127.0.0.1:8765",
    "appId": "sample-ipc"
  },
  "ui": {
    "tabs": [
      {
        "id": "status",
        "title": "Status",
        "widgets": [
          {
            "type": "kv",
            "title": "Status",
            "items": [
              {
                "label": "App Id",
                "jsonpath": "$.appId"
              }
            ]
          }
        ]
      }
    ]
  }
}
